{
  "schema": "juicyfruit.task/v1",
  "id": "JCF-01M1HJQPXHKQFBXPYYJP",
  "title": "Add README and memory closure checks to flow",
  "status": "DONE",
  "priority": "normal",
  "run": null,
  "created_at": "2026-09-02T17:30:13.808219Z",
  "updated_at": "2026-09-02T17:36:09.297100Z",
  "owner": {
    "adapter": "codex",
    "agent": "executor",
    "session": "SES-01M1HJQPXFJ79TXHX370"
  },
  "previous_owner": null,
  "dependencies": [],
  "acceptance": [
    "master flow requires README review before completion",
    "master flow checks changed memory-relevant items before completion"
  ],
  "context": {
    "topics": [],
    "files": [
      "docs/architecture/task-runtime.md",
      "skills/autopilot/SKILL.md",
      "skills/team/SKILL.md",
      "skills/plan/SKILL.md",
      "README.md"
    ]
  },
  "checkpoint": {
    "completed": [
      " and README set",
      " and format target",
      " plan",
      " planner",
      " purpose",
      " team",
      "added README and memory closure checks to master flow",
      "documented closure checks in autopilot",
      "documented project-root blank template scaffold and path reporting",
      "made template new collect kind",
      "recorded project memory note for the durable convention"
    ],
    "current": "verification complete",
    "remaining": [
      "mark verified and done"
    ],
    "changed_files": [
      ".juicyfruit/memory/notes/2026-09-02-flow-closure-checks.md",
      "CHANGELOG.md",
      "README.es.md",
      "README.md",
      "README.pt-BR.md",
      "agents/planner.md",
      "cli/README.md",
      "cli/lib/src/commands/template_command.dart",
      "cli/test/src/commands/template_command_test.dart",
      "docs/architecture/task-runtime.md",
      "docs/architecture/templates.md",
      "skills/autopilot/SKILL.md",
      "skills/plan/SKILL.md",
      "skills/team/SKILL.md"
    ],
    "validations": {
      "dart format": "passed",
      "dart analyze": "passed",
      "dart test": "passed"
    },
    "next_action": null
  },
  "blocker": null
}
