{
  "schema": "juicyfruit.task/v1",
  "id": "JCF-01M1HJE45GE5F3V3JZFG",
  "title": "Remove HUD and strengthen ambiguity questioning",
  "status": "DONE",
  "priority": "normal",
  "run": null,
  "created_at": "2026-09-02T17:24:59.695838Z",
  "updated_at": "2026-09-02T17:28:01.755313Z",
  "owner": {
    "adapter": "codex",
    "agent": "executor",
    "session": "SES-01M1HJE45FR3TH5BM1FA"
  },
  "previous_owner": null,
  "dependencies": [],
  "acceptance": [
    "HUD app and references are removed",
    "planning flow asks clarifying questions before planning when ambiguity matters"
  ],
  "context": {
    "topics": [],
    "files": [
      "apps/hud",
      "skills/plan/SKILL.md",
      "agents/planner.md",
      "docs/architecture/task-runtime.md"
    ]
  },
  "checkpoint": {
    "completed": [
      "aligned README layout after HUD removal",
      "removed legacy HUD app and workflow",
      "strengthened ambiguity-before-planning rules"
    ],
    "current": "verification",
    "remaining": [
      "mark verified and done"
    ],
    "changed_files": [
      ".github/workflows/juicyfruit_hud.yaml",
      "CHANGELOG.md",
      "README.es.md",
      "README.md",
      "README.pt-BR.md",
      "agents/planner.md",
      "apps/hud",
      "docs/architecture/task-runtime.md",
      "docs/migrations/2026-08-25-hud-monorepo.md",
      "docs/migrations/2026-08-31-memory-subsystem.md",
      "skills/autopilot/SKILL.md",
      "skills/plan/SKILL.md",
      "skills/team/SKILL.md"
    ],
    "validations": {
      "dart format": "passed",
      "dart analyze": "passed",
      "dart test": "passed"
    },
    "next_action": null
  },
  "blocker": null
}
