{
  "schema": "juicyfruit.task/v1",
  "id": "JCF-01M1HNMCG7XB2AGRVEFC",
  "title": "Prepare Juicyfruit 1.0.0 release",
  "status": "DONE",
  "priority": "normal",
  "run": null,
  "created_at": "2026-09-02T18:20:50.565088Z",
  "updated_at": "2026-09-02T18:49:36.724907Z",
  "owner": {
    "adapter": "codex",
    "agent": "executor",
    "session": "SES-01M1HNMCG47YM8CE8WFH"
  },
  "previous_owner": null,
  "dependencies": [],
  "acceptance": [
    "CLI version sources are bumped to 1.0.0",
    "CHANGELOG has a 1.0.0 release entry",
    "release PR is opened and merged to main"
  ],
  "context": {
    "topics": [],
    "files": [
      "cli/pubspec.yaml",
      "cli/lib/src/version.dart",
      "CHANGELOG.md"
    ]
  },
  "checkpoint": {
    "completed": [
      "bumped CLI version sources to 1.0.0",
      "promoted changelog unreleased notes to 1.0.0",
      "reviewed README impact: no release-specific README update needed"
    ],
    "current": "prepare release PR",
    "remaining": [
      "commit",
      " push",
      " open PR",
      " merge"
    ],
    "changed_files": [
      "CHANGELOG.md",
      "cli/lib/src/version.dart",
      "cli/pubspec.yaml"
    ],
    "validations": {
      "dart format": "passed",
      "dart analyze": "passed",
      "dart test": "passed",
      "git diff --check": "passed"
    },
    "next_action": null
  },
  "blocker": null
}
