{
  "schema": "juicyfruit.task/v1",
  "id": "JCF-01M2H7KEX40XQM2YBSEK",
  "title": "Fase 3.3: Git Hooks Nativos (juicyfruit hooks install)",
  "status": "DONE",
  "priority": "p3",
  "run": null,
  "created_at": "2026-09-15T00:31:22.002338Z",
  "updated_at": "2026-09-15T00:33:56.528908Z",
  "owner": {
    "adapter": "claude",
    "agent": "executor",
    "session": "SES-01M2H7KQTMY3FSNFNGVV"
  },
  "previous_owner": null,
  "dependencies": [],
  "acceptance": [
    "Novo subcomando juicyfruit hooks install para configurar hooks do git",
    "Hooks automatizam o check de análise e formatação antes do commit",
    "Validado com testes automatizados e manualmente"
  ],
  "context": {
    "topics": [],
    "files": []
  },
  "checkpoint": {
    "completed": [
      "Adicionados testes unitarios automatizados em hooks_command_test.dart",
      "Criado HooksCommand com os subcomandos install e uninstall em cli/lib/src/commands/hooks_command.dart",
      "Criado pre-commit hook template padrao utilizando o wrapper de sandbox quando disponivel",
      "Registrado HooksCommand em command_runner.dart",
      "Validacao de 305 testes passando e analise estatica sem avisos"
    ],
    "current": null,
    "remaining": [],
    "changed_files": [
      "cli/lib/src/command_runner.dart",
      "cli/lib/src/commands/hooks_command.dart",
      "cli/test/src/commands/hooks_command_test.dart"
    ],
    "validations": {
      "format": "clean",
      "analyze": "clean",
      "tests": "305_passed"
    },
    "next_action": "Marcar tarefa como verify e done atualizar o checklist do plano e commitar"
  },
  "blocker": null
}
