{
  "schema": "juicyfruit.task/v1",
  "id": "JCF-01M2GZA9PQTAGZFP6HBE",
  "title": "Avaliar projeto Juicyfruit e formular plano de melhoria/evolução",
  "status": "DONE",
  "priority": "normal",
  "run": null,
  "created_at": "2026-09-14T22:06:33.172842Z",
  "updated_at": "2026-09-14T22:07:56.813480Z",
  "owner": {
    "adapter": "codex",
    "agent": "executor",
    "session": "SES-01M2GZADP4CENZA954H6"
  },
  "previous_owner": null,
  "dependencies": [],
  "acceptance": [
    "Documento de avaliação técnica com opinião crítica criado em docs/",
    "Plano de melhoria/evolução estruturado em fases com prioridades"
  ],
  "context": {
    "topics": [],
    "files": [
      "README.md",
      "cli/lib/src",
      "docs/architecture"
    ]
  },
  "checkpoint": {
    "completed": [
      " CLI Dart",
      " adapters",
      " agents",
      " ligando cada gap a comandos/arquivos reais checados nesta sessao",
      " memory)",
      " packages",
      " task runtime",
      "Adicionei secao 6 (Evidencias de Verificacao Empirica) ao plano",
      "Confirmei ausencia de 'task report'/'task board' via grep no codigo e docs",
      "Confirmei que adapters/ na raiz so tem .gitkeep e que memory keyword_search.dart nao tem parametro de peso hibrido ajustavel",
      "Explorei estrutura do repo (README",
      "Reproduzi falha real de I/O do dart/fvm tentando escrever em diretorio global (confirma gap 1 do plano)",
      "Revisei docs/PLANO_MELHORIA_EVOLUCAO_JUICYFRUIT.md existente e validei suas alegações contra o código-fonte"
    ],
    "current": "Documento final revisado e consistente",
    "remaining": [],
    "changed_files": [
      "docs/PLANO_MELHORIA_EVOLUCAO_JUICYFRUIT.md"
    ],
    "validations": {},
    "next_action": null
  },
  "blocker": null
}
