{
  "schema": "juicyfruit.task/v1",
  "id": "JCF-01M2H2FDGR1B27APQCMP",
  "title": "Fase 2.1: ranking hibrido ajustavel em juicyfruit memory search",
  "status": "DONE",
  "priority": "normal",
  "run": null,
  "created_at": "2026-09-14T23:01:46.637132Z",
  "updated_at": "2026-09-14T23:14:18.103783Z",
  "owner": {
    "adapter": "codex",
    "agent": "executor",
    "session": "SES-01M2H2GJBS3Y40E7F665"
  },
  "previous_owner": null,
  "dependencies": [],
  "acceptance": [
    "Comando juicyfruit memory search aceita um parametro de peso entre busca lexica e vetorial",
    "Score combinado normaliza e pondera keywordSearch e embeddingSearch",
    "dart analyze e dart test cobrindo o novo modulo passam via scripts/dart-sandbox.sh"
  ],
  "context": {
    "topics": [],
    "files": []
  },
  "checkpoint": {
    "completed": [
      "12 novos testes cobrindo hybrid_search vector_index e memory_command",
      "Adicionada flag --weight em juicyfruit memory search (0=keyword-only 1=vector-only)",
      "Adicionado parametro vectorWeight em MemoryStore.search com pool de candidatos ampliado antes do blend",
      "Criado modulo hybrid_search.dart com combineHybridHits que normaliza e pondera keyword+vector scores"
    ],
    "current": null,
    "remaining": [],
    "changed_files": [
      "cli/lib/src/commands/memory_command.dart",
      "cli/lib/src/memory/hybrid_search.dart",
      "cli/lib/src/memory/memory.dart",
      "cli/lib/src/memory/memory_models.dart",
      "cli/lib/src/memory/memory_store.dart",
      "cli/test/src/commands/memory_command_test.dart",
      "cli/test/src/memory/hybrid_search_test.dart",
      "cli/test/src/memory/vector_index_test.dart"
    ],
    "validations": {
      "dart_analyze": "pass",
      "dart_format": "pass",
      "dart_test": "pass_281_tests"
    },
    "next_action": null
  },
  "blocker": null
}
