{
  "schema": "juicyfruit.task/v1",
  "id": "JCF-01M2H1DSNZZY7GZDXMH7",
  "title": "Fase 3.1: juicyfruit task report (metricas de runtime)",
  "status": "DONE",
  "priority": "high",
  "run": null,
  "created_at": "2026-09-14T22:43:24.979030Z",
  "updated_at": "2026-09-14T22:52:02.025973Z",
  "owner": {
    "adapter": "codex",
    "agent": "executor",
    "session": "SES-01M2H1E8XMBB2W75JZ57"
  },
  "previous_owner": null,
  "dependencies": [],
  "acceptance": [
    "Novo subcomando 'juicyfruit task report' agrega tempo-em-status",
    " taxa de bloqueio e duracao de verificacao a partir dos task-events",
    "dart analyze e dart test cobrindo o novo modulo passam via scripts/dart-sandbox.sh"
  ],
  "context": {
    "topics": [],
    "files": [
      "cli/lib/src/task_runtime/task_runtime_report.dart",
      "cli/lib/src/commands/task_command.dart"
    ]
  },
  "checkpoint": {
    "completed": [
      " blocked/unblocked repetido e serializacao JSON",
      "Adicionado subcommand juicyfruit task report (texto e --json) em task_command.dart",
      "Implementado TaskRuntimeReport (task_runtime_report.dart) reconstruindo intervalos de status a partir dos task-events",
      "Testes unitarios cobrindo lifecycle completo",
      "Testes unitarios cobrindo lifecycle completo blocked-unblocked repetido e serializacao JSON",
      "Testes unitarios cobrindo lifecycle completo blocked/unblocked repetido e serializacao JSON"
    ],
    "current": "Pronto para verify",
    "remaining": [
      "Nenhum"
    ],
    "changed_files": [
      "cli/lib/src/commands/task_command.dart",
      "cli/lib/src/task_runtime/task_runtime.dart",
      "cli/lib/src/task_runtime/task_runtime_report.dart",
      "cli/test/src/commands/task_runtime_command_test.dart",
      "cli/test/src/task_runtime/task_runtime_report_test.dart"
    ],
    "validations": {
      "dart_analyze": "pass",
      "dart_format": "pass",
      "dart_test": "pass_269_tests"
    },
    "next_action": "verify e done"
  },
  "blocker": null
}
