{
  "schema": "juicyfruit.task/v1",
  "id": "JCF-01M2H86YEVH5T37J3BP1",
  "title": "Fase 4.2: Sincronizacao e Busca de Pacotes Terceiros (juicyfruit source sync/search)",
  "status": "DONE",
  "priority": "p3",
  "run": null,
  "created_at": "2026-09-15T00:42:00.514824Z",
  "updated_at": "2026-09-15T00:47:21.870417Z",
  "owner": {
    "adapter": "claude",
    "agent": "executor",
    "session": "SES-01M2H87D0G9X2XKQ6HD0"
  },
  "previous_owner": null,
  "dependencies": [],
  "acceptance": [
    "Adicionado subcomando juicyfruit source sync para sincronizacao e revalidacao de fontes registradas",
    "Adicionado subcomando juicyfruit source search para busca de pacotes em fontes registradas",
    "Testes automatizados cobrindo sync e search no SourceCommand"
  ],
  "context": {
    "topics": [],
    "files": []
  },
  "checkpoint": {
    "completed": [
      "Adicionados subcomandos juicyfruit source sync e juicyfruit source search",
      "Adicionados testes unitarios e de subcomando em source_command_test.dart",
      "Implementada busca de pacotes baseada em id/name/description usando PackageCatalog",
      "Implementada sincronizacao de fontes registradas usando SourceRegistry.test",
      "Validada suite completa com 308 testes passando e analise sem avisos"
    ],
    "current": null,
    "remaining": [],
    "changed_files": [
      "cli/lib/src/commands/source_command.dart",
      "cli/test/src/commands/source_command_test.dart"
    ],
    "validations": {
      "format": "clean",
      "analyze": "clean",
      "tests": "308_passed"
    },
    "next_action": "Marcar tarefa como verify e done atualizar o checklist do plano e commitar"
  },
  "blocker": null
}
